{
  "protocol_version": "1.3",
  "round": 1,
  "task_id": "example-1",
  "title": "Which services use credential X",
  "proposed_solution": "Packet of four claims with its evidence bundle.",
  "known_concerns": [],
  "questions": [],
  "packet_digest": "4444444444444444444444444444444444444444444444444444444444444444",
  "bundle_digest": "1111111111111111111111111111111111111111111111111111111111111111"
}
