{
  "protocol_version": "1.3",
  "round": 1,
  "task_id": "credential-audit",
  "title": "Which services use credential X, and how heavily",
  "proposed_solution": "A claim packet answering the requester's question, with an evidence bundle of the two committed service configs, the September usage export, the requester's note and the vendor's key policy.",
  "known_concerns": [],
  "questions": [
    "Is the September export enough to size the rotation?"
  ],
  "packet_digest": "2ed367292b22ead84b156cd88c61b57fa06e047f773d8916af51db895d2d7cba",
  "bundle_digest": "be4cc8bb88dd9c488e281e68b4c27c89d9ac4a332d2d0c1a61979d553e150ec9"
}
